Article_Month,Article_Title,Article_Category,Article_ID
July,Mobile multimedia slow to catch on,technology,article-jul-4341
July,Mobiles get set for visual radio,technology,article-jul-3525
July,Mobiles rack up 20 years of use,technology,article-jul-2544
July,Molby says Gravesen is Real deal,sport,article-jul-0637
July,More power to the people says HP,technology,article-jul-4798
July,Musicians 'upbeat' about the net,technology,article-jul-2909
July,News Corp eyes video games market,business,article-jul-2815
July,Article no longer available in archive,N/A,N/A
July,No half measures with Half-Life 2,technology,article-jul-4628
July,Parmar ruled out of Davis Cup tie,sport,article-jul-1361
July,Philippoussis doubt over Open bid,sport,article-jul-0597
July,Pompeii gets digital make-over,technology,article-jul-2241
July,Q&A: Malcolm Glazer and Man Utd,business,article-jul-1728
July,Radcliffe eyes hard line on drugs,sport,article-jul-1219
July,Real will finish abandoned match,sport,article-jul-4829
July,Ref stands by Scotland decisions,sport,article-jul-1320
July,Robinson wants dual code success,sport,article-jul-2463
July,Roche 'turns down Federer offer',sport,article-jul-3438
July,Article no longer available in archive,N/A,N/A
July,Roddick splits from coach Gilbert,sport,article-jul-4719
July,Ronaldinho denies Blues interest,sport,article-jul-3289
July,S Korea spending boost to economy,business,article-jul-2439
July,S Korean consumers spending again,business,article-jul-3943
July,Saudi investor picks up the Savoy,business,article-jul-3331
July,Sella wants Michalak recall,sport,article-jul-3957
July,Share boost for feud-hit Reliance,business,article-jul-0733
July,Shares rise on new Man Utd offer,business,article-jul-0168
July,Sony PSP tipped as a 'must-have',technology,article-jul-2667
July,Souness eyes summer move for Owen,sport,article-jul-4244
July,Souped-up wi-fi is on the horizon,technology,article-jul-0334
July,South African car demand surges,business,article-jul-0645
July,Stam spices up Man Utd encounter,sport,article-jul-3380
July,Tapping-up row is so much hot air,sport,article-jul-0019
July,Technology gets the creative bug,technology,article-jul-4790
July,Technology in rugby: GPS systems continue to grow in importance,technology,article-jul-4384
July,Tindall aiming to earn Lions spot,sport,article-jul-3522
July,Tindall wants second opinion,sport,article-jul-1717
July,Tsunami 'to hit Sri Lanka banks',business,article-jul-1112
July,UK economy facing 'major risks',business,article-jul-0202
July,US Ahold suppliers face charges,business,article-jul-1885
July,US data sparks inflation worries,business,article-jul-3830
July,US interest rate rise expected,business,article-jul-0931
July,US peer-to-peer pirates convicted,technology,article-jul-1059
July,"Umaga ready for ""fearsome"" Lions",sport,article-jul-3879
July,Virus poses as Christmas e-mail,technology,article-jul-4233
July,Wal-Mart fights back at accusers,business,article-jul-0417
July,Wales coach elated with win,sport,article-jul-3332
July,Article no longer available in archive,N/A,N/A
July,Warning over US pensions deficit,business,article-jul-0589
July,Web photo storage market hots up,technology,article-jul-4193
July,Web radio takes Spanish rap global,technology,article-jul-0503
July,Wenger keeping faith with Almunia,sport,article-jul-1350
July,Wenger steps up row,sport,article-jul-1729
July,What now for British tennis?,sport,article-jul-4500
July,White admits to Balco drugs link,sport,article-jul-3874
July,World tour for top video gamers,technology,article-jul-2168
August,$1m payoff for former Shell boss,business,article-aug-3515
August,Anti-tremor mouse stops PC shakes,technology,article-aug-1123
August,Apple unveils low-cost 'Mac mini',technology,article-aug-4475
August,"Argentina, Venezuela in oil deal",business,article-aug-3384
August,Argentine great Caniggia retires,sport,article-aug-4019
August,Banker loses sexism claim,business,article-aug-0806
August,Beijingers fume over parking fees,business,article-aug-4964
August,Bell set for England debut,sport,article-aug-4265
August,Benitez issues warning to Gerrard,sport,article-aug-3926
August,Blackburn 0-1 Chelsea,sport,article-aug-4614
August,Brazil plays down Varig rescue,business,article-aug-2567
August,Britons fed up with net service,technology,article-aug-4701
August,Broadband takes on TV viewing,technology,article-aug-0893
August,Brussels raps mobile call charges,business,article-aug-4668
August,Butler strikes gold in Spain,sport,article-aug-1637
August,Chelsea denied by James heroics,sport,article-aug-0324
August,China had role in Yukos split-up,business,article-aug-0908
August,Clijsters hope on Aussie Open,sport,article-aug-1443
August,Costin aims for comeback in 2006,sport,article-aug-3079
August,DaimlerChrysler's 2004 sales rise,business,article-aug-0896
August,Dal Maso in to replace Bergamasco,sport,article-aug-4896
August,Davenport hits out at Wimbledon,sport,article-aug-3579
August,Dein concerned by Chelsea stance,sport,article-aug-4658
August,Deutsche Boerse boosts dividend,business,article-aug-2737
August,EU ministers to mull jet fuel tax,business,article-aug-1784
August,Euronext joins bid battle for LSE,business,article-aug-2063
August,Featured: 'No re-draft' for EU patent law,technology,article-aug-1532
August,Featured: 'Ultimate game' award for Doom 3,technology,article-aug-0644
August,Article no longer available in archive,N/A,N/A
August,Fed chief warning on US deficit,business,article-aug-3247
August,Ferguson rues failure to cut gap,sport,article-aug-2464
August,GM pays $2bn to evade Fiat buyout,business,article-aug-2142
August,GSK aims to stop Aids profiteers,business,article-aug-1157
August,GTA sequel is criminally good,technology,article-aug-2119
August,"Gamer buys $26,500 virtual land",technology,article-aug-3859
August,Google's toolbar sparks concern,technology,article-aug-1614
August,Greene sets sights on world title,sport,article-aug-3206
August,Henman to face Saulnier test,sport,article-aug-3335
August,Holmes back on form in Birmingham,sport,article-aug-2889
August,Home loan approvals rising again,business,article-aug-0763
August,Huge rush for Jet Airways shares,business,article-aug-0648
August,IBM puts cash behind Linux push,technology,article-aug-1226
August,India unveils anti-poverty budget,business,article-aug-2762
August,Injury doubts beset Wales squad,sport,article-aug-0319
August,"Intercom Are Doubling Their Product Teams In SF, Dublin & London",technology,article-aug-3240
August,Ireland 19-13 England,sport,article-aug-1817
August,Ireland win eclipses refereeing 'errors',sport,article-aug-0781
August,Article no longer available in archive,N/A,N/A
August,Japan economy slides to recession,business,article-aug-4887
August,Japan's ageing workforce: built to last,business,article-aug-4692
August,Article no longer available in archive,N/A,N/A
August,Japanese growth grinds to a halt,business,article-aug-0685
August,Jobs go at Oracle after takeover,business,article-aug-1101
August,Jobs growth still slow in the US,business,article-aug-1823
August,Johnson accuses British sprinters,sport,article-aug-3199
August,LSE doubts boost bidders' shares,business,article-aug-0176
August,Lasers help bridge network gaps,technology,article-aug-1452
August,Lewis-Francis turns to Christie,sport,article-aug-3112
August,Man City 0-2 Man Utd,sport,article-aug-0373
August,Man Utd women's team to be axed,sport,article-aug-4936
August,Markets fall on weak dollar fears,business,article-aug-1558
August,Marsh executive in guilty plea,business,article-aug-3754
August,McDonald's boss Bell dies aged 44,business,article-aug-2783
August,McIlroy wins 800m indoor title,sport,article-aug-4587
August,Mexican in US send $16bn home,business,article-aug-3962
August,Microsoft launches its own search,technology,article-aug-0665
August,Microsoft releases bumper patches,technology,article-aug-3312
August,Microsoft sets sights on spyware,technology,article-aug-2549
August,Mixed Christmas for US retailers,business,article-aug-4009
August,Mixed reaction to Man Utd offer,business,article-aug-2180
August,Murray to make Cup history,sport,article-aug-3857
August,Musical future for phones,technology,article-aug-3877
August,Net fingerprints combat attacks,technology,article-aug-3101
August,New browser wins over net surfers,technology,article-aug-3408
August,News Corp eyes video games market,business,article-aug-3126
August,No seasonal lift for house market,business,article-aug-2688
August,O'Sullivan quick to hail Italians,sport,article-aug-2601
August,Online News poll indicates economic gloom,business,article-aug-1976
August,Parmalat boasts doubled profits,business,article-aug-4015
August,PlayStation 3 processor unveiled,technology,article-aug-4910
August,Podcasts mark rise of DIY radio,technology,article-aug-1990
August,Police detain Chinese milk bosses,business,article-aug-3360
August,Poll explains free-kick decision,sport,article-aug-3213
August,Radcliffe proves doubters wrong,sport,article-aug-3564
August,Radcliffe will compete in London,sport,article-aug-4998
August,Roddick into San Jose final,sport,article-aug-0801
August,Ruddock backs Yapp's credentials,sport,article-aug-4456
August,S&N extends Indian beer venture,business,article-aug-4931
August,SA return to Mauritius,sport,article-aug-4232
August,Safin slumps to shock Dubai loss,sport,article-aug-1046
August,Sales 'fail to boost High Street',business,article-aug-3940
August,Santini resigns as Spurs manager,sport,article-aug-4740
August,Serena ends Sania Mirza's dream,sport,article-aug-2812
August,Set your television to wow,technology,article-aug-0633
August,Small firms 'hit by rising costs',business,article-aug-3280
August,Souness delight at Euro progress,sport,article-aug-4746
August,Stars shine for tsunami benefit,sport,article-aug-4220
August,Strachan turns down Pompey,sport,article-aug-1720
August,Strong demand triggers oil rally,business,article-aug-1390
August,Sydney to host north v south game,sport,article-aug-2437
August,Telegraph newspapers axe 90 jobs,business,article-aug-1486
August,UK bank seals South Korean deal,business,article-aug-2512
August,UK homes hit £3.3 trillion total,business,article-aug-1933
August,US Airways staff agree to pay cut,business,article-aug-1337
August,US budget deficit to reach $368bn,business,article-aug-4172
August,US interest rates increased to 2%,business,article-aug-3301
August,US woman sues over ink cartridges,technology,article-aug-2517
August,Uganda FA suspended,sport,article-aug-4672
August,Ukraine strikes Turkmen gas deal,business,article-aug-0800
August,Video phone help for deaf people,technology,article-aug-0840
August,Viewers to be able to shape TV,technology,article-aug-4831
August,WRU proposes season overhaul,sport,article-aug-2563
August,Watchdog probes Vivendi bond sale,business,article-aug-4625
August,Weak data buffets French economy,business,article-aug-1797
August,White prepared for battle,sport,article-aug-2487
August,Williams stays on despite dispute,sport,article-aug-0053
August,Wipro beats forecasts once again,business,article-aug-1767
August,WorldCom bosses' $54m payout,business,article-aug-3362
August,Young debut cut short by Ginepri,sport,article-aug-1146
September,Adriano's Chelsea link rejected,sport,article-sep-1375
September,Alfa Romeos 'to get GM engines',business,article-sep-3874
September,Amex shares up on spin-off news,business,article-sep-0096
September,Apple attacked over sources row,technology,article-sep-3814
September,Aragones angered by racism fine,sport,article-sep-4619
September,Asian banks halt dollar's slide,business,article-sep-3639
September,Attack prompts Bush site block,technology,article-sep-4996
September,Beckham relief as Real go through,sport,article-sep-3370
September,Beckham's chat reigns in Spain,sport,article-sep-0503
September,Blatter suggests offside change,sport,article-sep-4426
September,Bomb threat at Bernabeu stadium,sport,article-sep-1785
September,Bristol City 2-1 Milton Keynes,sport,article-sep-3918
September,Cairn Energy in Indian gas find,business,article-sep-0401
September,Campbell lifts lid on United feud,sport,article-sep-2816
September,Can Yahoo dominate next decade?,technology,article-sep-3016
September,Cars pull down US retail figures,business,article-sep-2767
September,Chelsea 3-0 Portsmouth,sport,article-sep-4852
September,Chepkemei hit by big ban,sport,article-sep-1803
September,Chinese dam firm 'defies Beijing',business,article-sep-0386
September,Concern over RFID tags,technology,article-sep-3587
September,Davenport puts retirement on hold,sport,article-sep-1349
September,Dollar hits new low versus euro,business,article-sep-3570
September,Domain system opens door to scams,technology,article-sep-4970
September,"Dutch bank to lay off 2,850 staff",business,article-sep-0920
September,Edgy Agassi struggles past Dent,sport,article-sep-4665
September,Edwards tips Idowu for Euro gold,sport,article-sep-3053
September,Electronics firms eye plasma deal,business,article-sep-4093
September,England claim Dubai Sevens glory,sport,article-sep-1145
September,England's defensive crisis grows,sport,article-sep-3077
September,Ericsson sees earnings improve,business,article-sep-2562
September,FAO warns on impact of subsidies,business,article-sep-4352
September,Faultless Federer has no equal,sport,article-sep-2859
September,Fear will help France - Laporte,sport,article-sep-3900
September,Featured: 'No re-draft' for EU patent law,technology,article-sep-3760
September,Article no longer available in archive,N/A,N/A
September,Ferguson urges Henry punishment,sport,article-sep-2440
September,Ferrero eyes return to top form,sport,article-sep-2872
September,Fiat chief takes steering wheel,business,article-sep-4414
September,Football Manager scores big time,technology,article-sep-4877
September,Freeze on anti-spam campaign,technology,article-sep-3592
September,French suitor holds LSE meeting,business,article-sep-0022
September,Funding cut hits Wales Students,sport,article-sep-0232
September,Gadget show heralds MP3 Christmas,technology,article-sep-1748
September,Games firms 'face tough future',technology,article-sep-4345
September,Georgia plans hidden asset pardon,business,article-sep-1443
September,German jobless rate at new record,business,article-sep-4275
September,Gerrard happy at Anfield,sport,article-sep-0555
September,Go-ahead for Balkan oil pipeline,business,article-sep-4613
September,Golden rule 'intact' says ex-aide,business,article-sep-2949
September,Henman overcomes rival Rusedski,sport,article-sep-3287
September,Henry tipped for Fifa award,sport,article-sep-4860
September,Highbury tunnel players in clear,sport,article-sep-3046
September,Holmes urged to compete at Worlds,sport,article-sep-4890
September,How to make a gigapixel picture,technology,article-sep-3678
September,IAAF awaits Greek pair's response,sport,article-sep-3602
September,ID theft surge hits US consumers,business,article-sep-4876
September,Article no longer available in archive,N/A,N/A
September,India and Russia in energy talks,business,article-sep-4207
September,Indonesia 'declines debt freeze',business,article-sep-1238
September,Intel unveils laser breakthrough,technology,article-sep-4867
September,Iran budget seeks state sell-offs,business,article-sep-0823
September,Iraq to invite phone licence bids,business,article-sep-0254
September,Ireland 17-12 South Africa,sport,article-sep-3264
September,Ireland 21-19 Argentina,sport,article-sep-2587
September,Jarvis sells Tube stake to Spain,business,article-sep-4095
September,Krispy Kreme shares hit,business,article-sep-1406
September,Kuznetsova 'failed a drugs test',sport,article-sep-2272
September,Laporte tinkers with team,sport,article-sep-0584
September,Lions blow to World Cup winners,sport,article-sep-4404
September,Article no longer available in archive,N/A,N/A
September,Local net TV takes off in Austria,technology,article-sep-1405
September,Losing yourself in online gaming,technology,article-sep-2520
September,Media gadgets get moving,technology,article-sep-4936
September,Article no longer available in archive,N/A,N/A
September,Mobile gaming takes off in India,technology,article-sep-1696
September,More movies head to Sony's PSP,technology,article-sep-3711
September,More women turn to net security,technology,article-sep-3745
September,Mourinho expects fight to finish,sport,article-sep-0082
September,Moya clinches Cup for Spain,sport,article-sep-3128
September,Newcastle 27-27 Gloucester,sport,article-sep-4623
September,O'Driscoll saves Irish blushes,sport,article-sep-0592
September,O'Sullivan could run in Worlds,sport,article-sep-1313
September,Old Firm pair handed suspensions,sport,article-sep-1672
September,Online News leads interactive Bafta wins,technology,article-sep-0863
September,Palestinian economy in decline,business,article-sep-1411
September,Putting a face to 'Big Brother',technology,article-sep-3583
September,Rich grab half Colombia poor fund,business,article-sep-2426
September,Russia gets investment blessing,business,article-sep-3558
September,Saab to build Cadillacs in Sweden,business,article-sep-1539
September,Security warning over 'FBI virus',technology,article-sep-3347
September,Spain coach faces racism inquiry,sport,article-sep-2082
September,Spam e-mails tempt net shoppers,technology,article-sep-4027
September,Sporting rivals go to extra time,technology,article-sep-4329
September,Standard Life cuts policy bonuses,business,article-sep-4851
September,Stormy year for property insurers,business,article-sep-1519
September,Swap offer for pirated Windows XP,technology,article-sep-1782
September,Sydney return for Henin-Hardenne,sport,article-sep-4130
September,Takeover rumour lifts Exel shares,business,article-sep-2601
September,Tanzania gets Fifa backing,sport,article-sep-0226
September,Technology hijacked sports,technology,article-sep-2914
September,Tough rules for ringtone sellers,technology,article-sep-0174
September,Trial date is set for Balco case,sport,article-sep-4443
September,UK house prices dip in November,business,article-sep-0063
September,UK interest rates held at 4.75%,business,article-sep-4940
September,Venezuela identifies 'idle' farms,business,article-sep-2528
September,Verdict delay for Greek sprinters,sport,article-sep-4107
September,Verizon 'seals takeover of MCI',business,article-sep-2374
September,Vodafone appoints new Japan boss,business,article-sep-3813
September,WMC says Xstrata bid is too low,business,article-sep-2892
September,Warnings on woeful wi-fi security,technology,article-sep-0388
September,Wembley firm won't make a profit,business,article-sep-3414
September,Will Manchester United plc Short Squeeze Soon,business,article-sep-2293
September,Worldcom director ends evidence,business,article-sep-1752
September,Yeading face Newcastle in FA Cup,sport,article-sep-2040
September,Yukos owner sues Russia for $28bn,business,article-sep-0237
September,Yukos unit buyer faces loan claim,business,article-sep-2517
October,A need to limit foreign numbers,sport,article-oct-3861
October,Apple iPod family expands market,technology,article-oct-0443
October,Apple sues 'Tiger' file sharers,technology,article-oct-0777
October,Apple sues to stop product leaks,technology,article-oct-1914
October,Athens memories soar above lows,sport,article-oct-2035
October,Ban hits Half-Life 2 pirates hard,technology,article-oct-0709
October,Bath faced with Tindall ultimatum,sport,article-oct-1226
October,Bellamy fined after row,sport,article-oct-0945
October,Brazil approves bankruptcy reform,business,article-oct-1295
October,Britain boosted by Holmes double,sport,article-oct-4199
October,Britons fed up with net service,technology,article-oct-0924
October,Cactus diet deal for Phytopharm,business,article-oct-3880
October,Call centre users 'lose patience',business,article-oct-3790
October,Call for Kenteris to be cleared,sport,article-oct-3326
October,Call for action on internet scam,technology,article-oct-1924
October,Camera phones are 'must-haves',technology,article-oct-3040
October,China's Shanda buys stake in Sina,business,article-oct-1787
October,Chip maker backs net phone calls,technology,article-oct-2701
October,Article no longer available in archive,N/A,N/A
October,Cole refuses to blame van Persie,sport,article-oct-2317
October,Collins appeals against drugs ban,sport,article-oct-0300
October,Consumers drive French economy,business,article-oct-4879
October,Crusaders 2-3 Ballymena United,sport,article-oct-0163
October,Desailly backs Blues revenge trip,sport,article-oct-4089
October,Digital guru floats sub-$100 PC,technology,article-oct-4812
October,Doors open at biggest gadget fair,technology,article-oct-4850
October,Double injury blow strikes Wales,sport,article-oct-3470
October,EU software patent law faces axe,technology,article-oct-4758
October,Ebbers 'aware' of WorldCom fraud,business,article-oct-2145
October,England given tough Sevens draw,sport,article-oct-3548
October,Europe backs digital TV lifestyle,technology,article-oct-3256
October,Executive trio leave Aer Lingus,business,article-oct-4836
October,FA Cup losing its sheen,sport,article-oct-2748
October,Fast moving phone viruses appear,technology,article-oct-0832
October,Featured: 'Standoff' on Deutsche's LSE bid,business,article-oct-2828
October,Featured: 'Ultimate game' award for Doom 3,technology,article-oct-0817
October,Federer joins all-time greats,sport,article-oct-2348
October,Formula 1: US-Qatari investors 'to bid for sport',sport,article-oct-1261
October,Fosters buys stake in winemaker,business,article-oct-0898
October,French consumer spending rising,business,article-oct-1441
October,Games 'deserve a place in class',technology,article-oct-0064
October,Gatlin and Hayes win Owen awards,sport,article-oct-2801
October,German bidder in talks with LSE,business,article-oct-2209
October,Global blogger action day called,technology,article-oct-2955
October,Greece defy the odds at Euro 2004,sport,article-oct-3459
October,Greek pair set for hearing,sport,article-oct-4140
October,Halo fans' hope for sequel,technology,article-oct-4990
October,Hariri killing hits Beirut shares,business,article-oct-3207
October,Hodgson relishes European clashes,sport,article-oct-0844
October,Hong Kong in 2011 World Cup bid,sport,article-oct-2177
October,IAAF will contest Greek decision,sport,article-oct-3103
October,IBM puts cash behind Linux push,technology,article-oct-4815
October,IMF agrees fresh Turkey funding,business,article-oct-4038
October,India and Iran in gas export deal,business,article-oct-1049
October,India power shares jump on debut,business,article-oct-1011
October,India's Deccan seals $1.8bn deal,business,article-oct-0417
October,Indian oil firm eyes Yukos assets,business,article-oct-3162
October,Israeli economy picking up pace,business,article-oct-0421
October,Japan bank shares up on link talk,business,article-oct-2333
October,Japanese mogul arrested for fraud,business,article-oct-4803
October,Kewell waits as injury drags on,sport,article-oct-1193
October,Khodorkovsky ally denies charges,business,article-oct-4546
October,Leeds v Saracens (Fri),sport,article-oct-0057
October,Liverpool pledge to keep Gerrard,sport,article-oct-4981
October,Llewellyn plans Wales retirement,sport,article-oct-4914
October,Lloyd's of London head chides FSA,business,article-oct-1753
October,Mauresmo opens with victory in LA,sport,article-oct-2102
October,Article no longer available in archive,N/A,N/A
October,Metlife buys up Citigroup insurer,business,article-oct-2774
October,Microsoft seeking spyware trojan,technology,article-oct-4605
October,Mobile audio enters new dimension,technology,article-oct-3910
October,Mobile networks seek turbo boost,technology,article-oct-2454
October,Movie body targets children's PCs,technology,article-oct-0059
October,Napster offers rented music to go,technology,article-oct-0992
October,New business technology trends,technology,article-oct-2740
October,Nike defends under-fire football,sport,article-oct-2886
October,Nintendo handheld given Euro date,technology,article-oct-4166
October,Nissan names successor to Ghosn,business,article-oct-2188
October,Nuclear body seeks new tech,technology,article-oct-4084
October,Oil prices reach three-month low,business,article-oct-2574
October,Open source leaders slam patents,technology,article-oct-3663
October,Owen determined to stay in Madrid,sport,article-oct-2181
October,Owen set for skipper role,sport,article-oct-0999
October,Peer-to-peer nets 'here to stay',technology,article-oct-2121
October,Pension hitch for long-living men,business,article-oct-2094
October,Article no longer available in archive,N/A,N/A
October,Radcliffe enjoys winning comeback,sport,article-oct-2301
October,Reboot ordered for EU patent law,technology,article-oct-0815
October,Article no longer available in archive,N/A,N/A
October,Relay squad thrilled with honours,sport,article-oct-3222
October,Reyes tricked into Real admission,sport,article-oct-4804
October,Rings of steel combat net attacks,technology,article-oct-1215
October,Rivals back anti-racism campaign,sport,article-oct-2080
October,Ryanair in $4bn Boeing plane deal,business,article-oct-0412
October,SA supports Fifa control,sport,article-oct-3387
October,Safin relieved at Aussie recovery,sport,article-oct-3524
October,Article no longer available in archive,N/A,N/A
October,Scotland 18-10 Italy,sport,article-oct-0580
October,Sculthorpe wants Lions captaincy,sport,article-oct-0746
