Article_Month,Article_Title,Article_Category,Article_ID
April,Disney backs Sony DVD technology,technology,article-apr-4827
April,Dollar slides ahead of New Year,business,article-apr-1926
April,Economy 'stronger than forecast',business,article-apr-1571
April,Electrolux to export Europe jobs,business,article-apr-1904
April,Ethiopia's crop production up 24%,business,article-apr-3933
April,FA charges Liverpool and Millwall,sport,article-apr-4960
April,FA probes crowd trouble,sport,article-apr-4241
April,Format wars could 'confuse users',technology,article-apr-4901
April,GM in crunch talks on Fiat future,business,article-apr-0724
April,Game makers get Xbox 2 sneak peek,technology,article-apr-4907
April,Gamers could drive high-definition,technology,article-apr-3088
April,Google launches TV search service,technology,article-apr-0395
April,Harinordoquy suffers France axe,sport,article-apr-4460
April,Hearts of Oak 3-2 Cotonsport,sport,article-apr-0524
April,Hodges announces rugby retirement,sport,article-apr-3536
April,Holmes feted with further honour,sport,article-apr-4694
April,Honour for UK games maker,technology,article-apr-3827
April,Houllier praises Benitez regime,sport,article-apr-2270
April,Humanoid robot learns how to run,technology,article-apr-0205
April,Ireland v USA (Sat),sport,article-apr-1858
April,Isinbayeva heads for Birmingham,sport,article-apr-3390
April,Israeli club look to Africa,sport,article-apr-3841
April,Junk e-mails on relentless rise,technology,article-apr-4467
April,Kluft impressed by Sotherton form,sport,article-apr-3842
April,Latin America sees strong growth,business,article-apr-3718
April,Libya takes $1bn in unfrozen funds,business,article-apr-0784
April,Loyalty cards idea for TV addicts,technology,article-apr-2677
April,Man City 1-1 Newcastle,sport,article-apr-3475
April,McCall earns Tannadice reprieve,sport,article-apr-2558
April,McClaren eyes Uefa Cup top spot,sport,article-apr-2706
April,McClaren hails Boro's Uefa spirit,sport,article-apr-4921
April,McIlroy aiming for Madrid title,sport,article-apr-0240
April,Microsoft makes anti-piracy move,technology,article-apr-2106
April,Microsoft seeking spyware trojan,technology,article-apr-0622
April,Mild winter drives US oil down 6%,business,article-apr-4699
April,Millions to miss out on the net,technology,article-apr-4622
April,Minister digs in over doping row,sport,article-apr-2061
April,Mirza makes Indian tennis history,sport,article-apr-0646
April,Mitsubishi in Peugeot link talks,business,article-apr-4064
April,Mobile multimedia slow to catch on,technology,article-apr-4854
April,Mobiles 'not media players yet',technology,article-apr-4446
April,Morientes admits to Reds struggle,sport,article-apr-0150
April,Mourinho plots impressive course,sport,article-apr-3146
April,Mourinho says race is almost over,sport,article-apr-1270
April,Article no longer available in archive,N/A,N/A
April,Moya sidesteps Davis Cup in 2005,sport,article-apr-2879
April,Nadal marches on in Mexico,sport,article-apr-1276
April,Nintendo adds media playing to DS,technology,article-apr-0061
April,O'Connell rejects Lions rumours,sport,article-apr-1620
April,O'Driscoll concern at Fifa ruling,sport,article-apr-2704
April,Oil prices fall back from highs,business,article-apr-4823
April,Ore costs hit global steel firms,business,article-apr-0564
April,Parry relishes Anfield challenge,sport,article-apr-0338
April,Peugeot deal boosts Mitsubishi,business,article-apr-4399
April,Article no longer available in archive,N/A,N/A
April,PlayStation 3 chip to be unveiled,technology,article-apr-4686
April,Portable PlayStation ready to go,technology,article-apr-2813
April,Premier League planning Cole date,sport,article-apr-0953
April,Qantas sees profits fly to record,business,article-apr-2019
April,Radcliffe yet to answer GB call,sport,article-apr-0042
April,Redknapp's Saints face Pompey tie,sport,article-apr-4569
April,Reds sink 10-man Magpies,sport,article-apr-2560
April,Reliance unit loses Anil Ambani,business,article-apr-1918
April,Rich pickings for hi-tech thieves,technology,article-apr-0857
April,Robinson out of Six Nations,sport,article-apr-0028
April,Rovers reject third Ferguson bid,sport,article-apr-1068
April,Saint-Andre anger at absent stars,sport,article-apr-4171
April,Article no longer available in archive,N/A,N/A
April,Salary scandal in Cameroon,business,article-apr-4618
April,Slimmer PlayStation triple sales,technology,article-apr-1300
April,Slovakia seal Hopman Cup success,sport,article-apr-1815
April,Smart search lets art fans browse,technology,article-apr-3833
April,Smith keen on Home series return,sport,article-apr-1205
April,South Africa sweep top awards,sport,article-apr-3471
April,Speak easy plan for media players,technology,article-apr-4435
April,Speech takes on search engines,technology,article-apr-0484
April,Tokyo says deflation 'controlled',business,article-apr-1009
April,Turkey turns on the economic charm,business,article-apr-0361
April,Turkey-Iran mobile deal 'at risk',business,article-apr-4474
April,UK 'risks breaking golden rule',business,article-apr-3423
April,UK firm faces Venezuelan land row,business,article-apr-3100
April,UK pioneers digital film network,technology,article-apr-0865
April,US bank in $515m SEC settlement,business,article-apr-0134
April,US crude prices surge above $53,business,article-apr-2219
April,Umaga ready for Lions,sport,article-apr-0182
April,Umbro profits lifted by Euro 2004,business,article-apr-4228
April,Virgin Radio offers 3G broadcast,technology,article-apr-3753
April,Virus poses as Christmas e-mail,technology,article-apr-2040
April,Voters flock to blog awards site,technology,article-apr-4036
April,Wales want rugby league training,sport,article-apr-4395
April,Wales win in Rome,sport,article-apr-4277
April,Warning over tsunami aid website,technology,article-apr-1102
April,Wolves appoint Hoddle as manager,sport,article-apr-3992
April,Wood - Ireland can win Grand Slam,sport,article-apr-3250
April,World leaders gather to face uncertainty,business,article-apr-4031
April,Worthington praises classy Villa,sport,article-apr-0896
April,Yachvili savours France comeback,sport,article-apr-3567
April,Article no longer available in archive,N/A,N/A
April,Yukos heading back to US courts,business,article-apr-3586
April,Yukos seeks court action on sale,business,article-apr-4951
April,Yukos unit fetches $9bn at auction,business,article-apr-0345
May,Air China in $1bn London listing,business,article-may-0284
May,Angry Williams rejects criticism,sport,article-may-3980
May,Apple Inc. Phone Pricing Likely To Trend Lower,business,article-may-2027
May,Argentina closes $102.6bn debt swap,business,article-may-2024
May,AstraZeneca hit by drug failure,business,article-may-2738
May,Balco case trial date pushed back,sport,article-may-4424
May,Battered dollar hits another low,business,article-may-2659
May,Beckham hints at Man Utd return,sport,article-may-4512
May,Benitez joy as Reds take control,sport,article-may-0131
May,Blind student 'hears in colour',technology,article-may-2874
May,Blogger grounded by her airline,technology,article-may-2905
May,Brazil jobless rate hits new low,business,article-may-1663
May,Broadband set to revolutionise TV,technology,article-may-1702
May,Bush website blocked outside US,technology,article-may-4777
May,Business confidence dips in Japan,business,article-may-2166
May,Businesses fail to plan for HIV,business,article-may-1662
May,Campese berates whingeing England,sport,article-may-1837
May,Cech sets clean-sheet benchmark,sport,article-may-1887
May,China 'blocks Google news site',technology,article-may-3273
May,China continues rapid growth,business,article-may-2294
May,Circuit City gets takeover offer,business,article-may-3257
May,Claxton hunting first major medal,sport,article-may-2723
May,Consumer concern over RFID tags,technology,article-may-1549
May,Continental 'may run out of cash',business,article-may-0149
May,Deadline nears for Fiat-GM deal,business,article-may-2122
May,Deutsche Boerse set to 'woo' LSE,business,article-may-4336
May,Domain system scam fear,technology,article-may-0706
May,Doors open at biggest gadget fair,technology,article-may-0573
May,Dunne keen to commit to Man City,sport,article-may-2915
May,EMI shares hit by profit warning,business,article-may-1785
May,EU to probe Alitalia 'state aid',business,article-may-1306
May,England 'to launch ref protest',sport,article-may-2222
May,Faye plans to stay at Portsmouth,sport,article-may-1674
May,Featured: 'Strong dollar' call halts slide,business,article-may-3633
May,Ferguson hails Man Utd's resolve,sport,article-may-3723
May,Fuming Robinson blasts officials,sport,article-may-2499
May,Further rise in UK jobless total,business,article-may-2400
May,Gadget growth fuels eco concerns,technology,article-may-2476
May,Gadget show heralds MP3 season,technology,article-may-2112
May,Games win for Blu-ray DVD format,technology,article-may-2581
May,German business confidence slides,business,article-may-2727
May,Gerrard future not decided by Cardiff loss,sport,article-may-0713
May,Halo 2 sells five million copies,technology,article-may-4324
May,Henin-Hardenne beaten on comeback,sport,article-may-4280
May,Hewitt falls to Dent in Adelaide,sport,article-may-0143
May,How to smash a home computer,technology,article-may-2440
May,Ireland call up uncapped Campbell,sport,article-may-1036
May,Israel looks to US for bank chief,business,article-may-0966
May,Keane defiant over Vieira bust-up,sport,article-may-4655
May,Kenya lift Chepkemei's suspension,sport,article-may-2796
May,Kraft cuts snack ads for children,business,article-may-0305
May,Lesotho textile workers lose jobs,business,article-may-2491
May,Lomu relishing return to action,sport,article-may-2781
May,Lufthansa may sue over Bush visit,business,article-may-1795
May,MCI shares climb on takeover bid,business,article-may-0332
May,MG Rover China tie-up 'delayed',business,article-may-4014
May,Making your office work for you,business,article-may-4886
May,McIlroy continues winning streak,sport,article-may-4104
May,Mobile TV tipped as one to watch,technology,article-may-1112
May,Monsanto fined $1.5m for bribery,business,article-may-0180
May,Moving mobile improves golf swing,technology,article-may-1740
May,Nadal puts Spain 2-0 up,sport,article-may-4133
May,Nasdaq planning $100m-share sale,business,article-may-0916
May,New Year's texting breaks record,technology,article-may-3761
May,Article no longer available in archive,N/A,N/A
May,New consoles promise big problems,technology,article-may-4517
May,Nintendo DS makes its Euro debut,technology,article-may-1326
May,O'Connor aims to grab opportunity,sport,article-may-0373
May,O'Leary agrees new Villa contract,sport,article-may-4484
May,Article no longer available in archive,N/A,N/A
May,O'Sullivan keeps his powder dry,sport,article-may-4229
May,Online commons to spark debate,technology,article-may-4474
May,Online games play with politics,technology,article-may-1687
May,Parmalat founder offers apology,business,article-may-1905
May,Parmalat to return to stockmarket,business,article-may-2611
May,Peer-to-peer nets 'here to stay',technology,article-may-4895
May,Pernod takeover talk lifts Domecq,business,article-may-0016
May,Profits jump at China's top bank,business,article-may-1238
May,Prop Jones ready for hard graft,sport,article-may-1947
May,Qatar and Shell in $6bn gas deal,business,article-may-2512
May,Quake's economic costs emerging,business,article-may-1598
May,Real in talks over Gravesen move,sport,article-may-4585
May,Rescue hope for Borussia Dortmund,business,article-may-4874
May,Robben and Cole earn Chelsea win,sport,article-may-0488
May,Robotic pods take on car design,technology,article-may-0292
May,Roddick in talks over new coach,sport,article-may-3235
May,SEC to rethink post-Enron rules,business,article-may-1464
May,Santy worm makes unwelcome visit,technology,article-may-2443
May,Seamen sail into biometric future,technology,article-may-2260
May,Serena becomes world number two,sport,article-may-3908
May,Smith aims to bring back respect,sport,article-may-2514
May,Soaring oil 'hits world economy',business,article-may-0985
May,Software watching while you work,technology,article-may-3855
May,Sony PSP console hits US in March,technology,article-may-0057
May,TV calls after Carroll error,sport,article-may-0549
May,TV's future down the phone line,technology,article-may-0738
May,Article no longer available in archive,N/A,N/A
May,The 'ticking budget' facing the US,business,article-may-1288
May,Train strike grips Buenos Aires,business,article-may-2467
May,UK broadband gets speed injection,technology,article-may-2263
May,US adds more jobs than expected,business,article-may-0648
May,US economy shows solid GDP growth,business,article-may-3222
May,US economy still growing says Fed,business,article-may-1355
May,US in EU tariff chaos trade row,business,article-may-3184
May,US retail sales surge in December,business,article-may-2365
May,US trade gap hits record in 2004,business,article-may-0720
May,Ukraine revisits state sell-offs,business,article-may-3287
May,Underdogs have more fun,sport,article-may-2299
May,VW considers opening Indian plant,business,article-may-0748
May,Wal-Mart to pay $14m in gun suit,business,article-may-4097
May,Wasps 31-37 Leicester,sport,article-may-2131
May,What high-definition will do to DVDs,technology,article-may-3461
May,Why Cell will get the hard sell,technology,article-may-4326
May,Wilkinson fit to face Edinburgh,sport,article-may-2814
May,Wilkinson return 'unlikely',sport,article-may-2271
May,Yahoo celebrates a decade online,technology,article-may-3619
May,Yahoo moves into desktop search,technology,article-may-0996
June,2D Metal Slug offers retro fun,technology,article-jun-1972
June,Anti-spam laws bite spammer hard,technology,article-jun-1987
June,Apple laptop is 'greatest gadget',technology,article-jun-0716
June,Apple makes blogs reveal sources,technology,article-jun-2935
June,Apple unveils low-cost 'Mac mini',technology,article-jun-4840
June,Arsenal 'may seek full share listing',business,article-jun-4479
June,BA to suspend two Saudi services,business,article-jun-1568
June,BMW drives record sales in Asia,business,article-jun-1579
June,BT offers equal access to rivals,business,article-jun-3219
June,Barwick calls for Highbury calm,sport,article-jun-1778
June,Barwick installed as new FA boss,sport,article-jun-1644
June,Be careful how you code,technology,article-jun-2609
June,Beer giant swallows Russian firm,business,article-jun-1346
June,Blinx sequel purrs nicely,technology,article-jun-3633
June,Bombardier chief to leave company,business,article-jun-3298
June,Bond game fails to shake or stir,technology,article-jun-3624
June,Britannia members' £42m windfall,business,article-jun-0532
June,California sets fines for spyware,technology,article-jun-2071
June,Call to save manufacturing jobs,business,article-jun-1491
June,Can Smith work Scottish wonders?,sport,article-jun-1294
June,Cebit fever takes over Hanover,technology,article-jun-1801
June,Chelsea clinch cup in extra-time,sport,article-jun-4596
June,China 'to overtake US net use',technology,article-jun-4483
June,China bans new tobacco factories,business,article-jun-0384
June,Davenport dismantles young rival,sport,article-jun-3025
June,Disaster claims 'less than $10bn',business,article-jun-3207
June,Dollar drops on reserves concerns,business,article-jun-3422
June,EU 'too slow' on economic reforms,business,article-jun-3285
June,English clubs make Euro history,sport,article-jun-1131
June,Ex-Boeing director gets jail term,business,article-jun-4266
June,FA decides not to punish Mourinho,sport,article-jun-4362
June,Fast lifts rise into record books,technology,article-jun-0537
June,Featured: 'Blog' picked as word of the year,technology,article-jun-1448
June,Featured: 'Brainwave' cap controls computer,technology,article-jun-4007
June,Featured: 'Podcasters' look to net money,technology,article-jun-3887
June,Fresh hope after Argentine crisis,business,article-jun-3406
June,Gadget market 'to grow in 2005',technology,article-jun-2920
June,Gates opens biggest gadget fair,technology,article-jun-2699
June,Gebrselassie in London triple bid,sport,article-jun-0332
June,Gerrard plays down European hopes,sport,article-jun-4500
June,Giant waves damage S Asia economy,business,article-jun-1482
June,Giving financial gifts to children,business,article-jun-0787
June,Golden rule boost for Chancellor,business,article-jun-2022
June,Henman hopes ended in Dubai,sport,article-jun-3687
June,Hitachi unveils 'fastest robot',technology,article-jun-3700
June,Hotspot users gain free net calls,technology,article-jun-3528
June,"How Manchester United, Knicks Wins Correlate With Stock Gains",business,article-jun-2557
June,Hyundai to build new India plant,business,article-jun-2381
June,Industrial revival hope for Japan,business,article-jun-1633
June,Insurance bosses plead guilty,business,article-jun-4342
June,Iraq and Afghanistan in WTO talks,business,article-jun-4535
June,Ireland surge past Scots,sport,article-jun-1155
June,Italy 17-28 Ireland,sport,article-jun-0553
June,JP Morgan admits US slavery links,business,article-jun-1387
June,Keegan hails comeback king Fowler,sport,article-jun-2401
June,Kenyan school turns to handhelds,technology,article-jun-4329
June,Long life promised for laptop PCs,technology,article-jun-1532
June,M&S cuts prices by average of 24%,business,article-jun-1434
June,MCI shareholder sues to stop bid,business,article-jun-2521
June,Market unfazed by Aurora setback,business,article-jun-2097
June,Microsoft takes on desktop search,technology,article-jun-2226
June,Millions 'to lose textile jobs',business,article-jun-4453
June,Mobile networks seek turbo boost,technology,article-jun-4509
June,Mobiles 'not media players yet',technology,article-jun-2467
June,Mobiles double up as bus tickets,technology,article-jun-1038
June,Mobiles rack up 20 years of use,technology,article-jun-2420
June,Article no longer available in archive,N/A,N/A
June,Mourinho takes swipe at Arsenal,sport,article-jun-4994
June,Mourinho to escape FA charge,sport,article-jun-3434
June,Net regulation 'still possible',technology,article-jun-4410
June,New delay hits EU software laws,technology,article-jun-0925
June,Newest EU members underpin growth,business,article-jun-1788
June,No lack of Christmas spirit,sport,article-jun-0749
June,O'Driscoll/Gregan lead Aid stars,sport,article-jun-4657
June,Optimism remains over UK housing,business,article-jun-2787
June,Orange colour clash set for court,business,article-jun-2319
June,Owen delighted with Real display,sport,article-jun-1141
June,Pandas benefit from wireless net,technology,article-jun-4805
June,Parents face video game lessons,technology,article-jun-0101
June,Petit career ended by knee injury,sport,article-jun-4636
June,Article no longer available in archive,N/A,N/A
June,Plymouth 3-0 Sheff Utd,sport,article-jun-1885
June,Preview: Ireland v England (Sun),sport,article-jun-1112
June,Prinz beats Hamm to Fifa trophy,sport,article-jun-4470
June,Profits slide at India's Dr Reddy,business,article-jun-3966
June,Prutton poised for lengthy FA ban,sport,article-jun-1668
June,Rivals of the £400 Apple...,technology,article-jun-1940
June,Robinson answers critics,sport,article-jun-0693
June,Rochus shocks Coria in Auckland,sport,article-jun-0583
June,"Rover deal 'may cost 2,000 jobs'",business,article-jun-4042
June,Article no longer available in archive,N/A,N/A
June,Running around the Olympics,sport,article-jun-1150
June,SA unveils 'more for all' budget,business,article-jun-0829
June,SBC plans post-takeover job cuts,business,article-jun-4361
June,Safety alert as GM recalls cars,business,article-jun-2660
June,Saudi ministry to employ women,business,article-jun-3293
June,Savvy searchers fail to spot ads,technology,article-jun-4523
June,Shares hit by MS drug suspension,business,article-jun-2536
June,Slowdown hits US factory growth,business,article-jun-0684
June,Spam e-mails tempt net shoppers,technology,article-jun-3126
June,Text messages aid disaster recovery,technology,article-jun-1396
June,The wonder of Ronaldinho,sport,article-jun-3380
June,The year search became personal,technology,article-jun-3599
June,Tomlinson stays focused on Europe,sport,article-jun-0780
June,Article no longer available in archive,N/A,N/A
June,US bank boss hails 'genius' Smith,business,article-jun-0505
June,US consumer confidence up,business,article-jun-2320
June,US trade deficit widens sharply,business,article-jun-3360
June,Uefa threat over foreign quotas,sport,article-jun-1094
June,Ukraine steel sell-off 'illegal',business,article-jun-2505
June,Ukraine trims privatisation check,business,article-jun-2405
June,Venus stunned by Farina Elia,sport,article-jun-4106
June,Video technology will not make football a mistake-free sport,sport,article-jun-0039
June,Warning over Windows Word files,technology,article-jun-2519
June,Weak dollar trims Cadbury profits,business,article-jun-1446
June,Web helps collect aid donations,technology,article-jun-1293
June,Wenger handed summer war chest,sport,article-jun-4259
June,When technology gets personal,technology,article-jun-4520
July,A decade of good website design,technology,article-jul-1745
July,Agassi fear for Melbourne,sport,article-jul-0465
July,Ailing EuroDisney vows turnaround,business,article-jul-4512
July,Ajax refuse to rule out Jol move,sport,article-jul-2758
July,Anelka apologises for criticism,sport,article-jul-4068
July,Apple attacked over sources row,technology,article-jul-1257
July,Apple iPod family expands market,technology,article-jul-2965
July,Argonaut founder rebuilds empire,technology,article-jul-2977
July,Arsenal 1-1 Sheff Utd,sport,article-jul-0794
July,Asia shares defy post-quake gloom,business,article-jul-0495
July,Aviation firms eye booming India,business,article-jul-2215
July,BT program to beat dialler scams,technology,article-jul-4187
July,Bat spit drug firm goes to market,business,article-jul-3607
July,Bees handed potential Man Utd tie,sport,article-jul-3406
July,Blackburn v Burnley,sport,article-jul-4480
July,Boeing unveils new 777 aircraft,business,article-jul-4575
July,Breaking news: US company admits Benin bribery,sport,article-jul-2829
July,Broadband in the UK growing fast,technology,article-jul-4356
July,Bryan twins keep US hopes alive,sport,article-jul-3487
July,Building giant in asbestos payout,business,article-jul-3941
July,California sets fines for spyware,technology,article-jul-4527
July,Call to overhaul UK state pension,business,article-jul-3516
July,Campbell to be Lions consultant,sport,article-jul-0165
July,Cantona issues Man Utd job hint,sport,article-jul-2340
July,Chinese exports rise 25% in 2004,business,article-jul-4614
July,Clijsters could play Aussie Open,sport,article-jul-2009
July,Corry backs skipper Robinson,sport,article-jul-2742
July,DVD copy protection strengthened,technology,article-jul-3010
July,Dallaglio his own man to the end,sport,article-jul-4101
July,Dawson wins England squad recall,sport,article-jul-2708
July,Dementieva prevails in Hong Kong,sport,article-jul-4268
July,Disney backs Sony DVD technology,technology,article-jul-4019
July,Dominici backs lacklustre France,sport,article-jul-1748
July,Dublin hi-tech labs to shut down,technology,article-jul-1249
July,Ebbers denies WorldCom fraud,business,article-jul-4170
July,England coach faces rap after row,sport,article-jul-2162
July,European losses hit GM's profits,business,article-jul-0339
July,Fifa agrees goal-line technology,sport,article-jul-2286
July,Freeze on anti-spam campaign,technology,article-jul-2988
July,French boss to leave EADS,business,article-jul-4021
July,German economy rebounds,business,article-jul-4373
July,Glazer makes new Man Utd approach,business,article-jul-4895
July,Google to scan famous libraries,technology,article-jul-4326
July,Greek sprinters 'won't run again',sport,article-jul-0662
July,Greek sprinters suspended by IAAF,sport,article-jul-2558
July,Gunners clock up winning record,sport,article-jul-3455
July,Halo 2 heralds traffic explosion,technology,article-jul-4969
July,Henson stakes early Lions claim,sport,article-jul-3422
July,Hewitt fights back to reach final,sport,article-jul-1711
July,Holmes is hit by hamstring injury,sport,article-jul-2063
July,IBM frees 500 software patents,technology,article-jul-2960
July,Article no longer available in archive,N/A,N/A
July,India's Reliance family feud heats up,business,article-jul-4915
July,India's rupee hits five-year high,business,article-jul-4812
July,Ink helps drive democracy in Asia,technology,article-jul-3520
July,Irish finish with home game,sport,article-jul-0643
July,J&J agrees $25bn Guidant deal,business,article-jul-3273
July,Johansson takes Adelaide victory,sport,article-jul-3870
July,Jones doping probe begins,sport,article-jul-0803
July,Kenteris denies faking road crash,sport,article-jul-4157
July,Khodorkovsky quits Yukos shares,business,article-jul-0297
July,Latest Opera browser gets vocal,technology,article-jul-4908
July,Article no longer available in archive,N/A,N/A
July,Legendary Dutch boss Michels dies,sport,article-jul-1013
July,Lions blow to World Cup stars,sport,article-jul-4496
July,Liverpool revel in night of glory,sport,article-jul-3168
July,Man Utd to open books to Glazer,business,article-jul-4242
July,Man Utd urged to seal Giggs deal,sport,article-jul-2527
July,Melzer shocks Agassi in San Jose,sport,article-jul-1760
July,Microsoft debuts security tools,technology,article-jul-4400
July,Millions buy MP3 players in US,technology,article-jul-4827
