Article_Month,Article_Title,Article_Category,Article_ID
January,21st-Century Sports: How Digital Technology Is Changing the Face Of The Sporting Industry,technology,article-jan-0418
January,Asian quake hits European shares,business,article-jan-0027
January,BT offers free net phone calls,technology,article-jan-0631
January,Barclays shares up on merger talk,business,article-jan-2105
January,Barkley fit for match in Ireland,sport,article-jan-3300
January,Bellamy under new fire,sport,article-jan-4187
January,Benitez 'to launch Morientes bid',sport,article-jan-1974
January,Benitez delight after crucial win,sport,article-jan-3666
January,Big war games battle it out,technology,article-jan-2629
January,British Library gets wireless net,technology,article-jan-2415
January,Brizzel to run AAA's in Sheffield,sport,article-jan-4210
January,Bush budget seeks deep cutbacks,business,article-jan-4789
January,Bush to get 'tough' on deficit,business,article-jan-3452
January,Cable offers video-on-demand,technology,article-jan-2428
January,Cabs collect mountain of mobiles,technology,article-jan-4766
January,Camera phones are 'must-haves',technology,article-jan-2595
January,Card fraudsters 'targeting web',business,article-jan-2935
January,Cash gives way to flexible friend,business,article-jan-0578
January,Cebit opens to mobile music tune,technology,article-jan-3023
January,Charvis set to lose fitness bid,sport,article-jan-2356
January,Chelsea hold Arsenal,sport,article-jan-1023
January,Christmas sales worst since 1981,business,article-jan-0641
January,Clijsters set for February return,sport,article-jan-2461
January,Clyde 0-5 Celtic,sport,article-jan-4541
January,Coach Ranieri sacked by Valencia,sport,article-jan-1259
January,Confusion over high-definition TV,technology,article-jan-4007
January,Cuba winds back economic clock,business,article-jan-4171
January,DS aims to touch gamers,technology,article-jan-0272
January,Dawson set for new Wasps contract,sport,article-jan-4894
January,Diageo to buy US wine firm,business,article-jan-4504
January,Digital guru floats sub-$100 PC,technology,article-jan-1740
January,EU aiming to fuel development aid,business,article-jan-2390
January,Article no longer available in archive,N/A,N/A
January,England 17-18 France,sport,article-jan-4471
January,Enron bosses in $168m payout,business,article-jan-3978
January,Euronext 'poised to make LSE bid',business,article-jan-2209
January,Europe asks Asia for euro help,business,article-jan-0858
January,Europe blames US over weak dollar,business,article-jan-3187
January,Fannie Mae 'should restate books',business,article-jan-1282
January,Featured: 'Brainwave' cap controls computer,technology,article-jan-3414
January,Featured: 'Evil twin' fear for wireless net,technology,article-jan-2289
January,Featured: 'Friends fear' with lost mobiles,technology,article-jan-1899
January,Article no longer available in archive,N/A,N/A
January,Featured: 'Post-Christmas lull' in lending,business,article-jan-3686
January,Fed warns of more US rate rises,business,article-jan-3679
January,Federer forced to dig deep,sport,article-jan-1469
January,Ferguson puts faith in youngsters,sport,article-jan-4815
January,GE sees 'excellent' world economy,business,article-jan-1761
January,GM issues 2005 profits warning,business,article-jan-4519
January,Gangsters dominate gaming chart,technology,article-jan-0248
January,Gardener wins double in Glasgow,sport,article-jan-1280
January,Article no longer available in archive,N/A,N/A
January,Gazprom 'in $36m back-tax claim',business,article-jan-0154
January,German growth goes into reverse,business,article-jan-4182
January,Germany calls for EU reform,business,article-jan-3155
January,Go-ahead for new internet names,technology,article-jan-0502
January,Greek duo cleared in doping case,sport,article-jan-1027
January,Hansen 'delays return until 2006',sport,article-jan-3810
January,Article no longer available in archive,N/A,N/A
January,Henman & Murray claim LTA awards,sport,article-jan-1481
January,Henman decides to quit Davis Cup,sport,article-jan-2551
January,Hi-tech posters guide commuters,technology,article-jan-0989
January,Hodgson shoulders England blame,sport,article-jan-0633
January,Hollywood to sue net film pirates,technology,article-jan-1566
January,Holmes secures comeback victory,sport,article-jan-0791
January,House prices suffer festive fall,business,article-jan-2691
January,IAAF launches fight against drugs,sport,article-jan-3650
January,India-Pakistan peace boosts trade,business,article-jan-1867
January,Iraqi voters turn to economic issues,business,article-jan-2835
January,Jansen suffers a further setback,sport,article-jan-1079
January,Latest Opera browser gets vocal,technology,article-jan-4592
January,Laura Ashley chief stepping down,business,article-jan-4111
January,Learning to love broadband,technology,article-jan-0599
January,Mac Mini heralds mini revolution,technology,article-jan-0969
January,Macy's owner buys rival for $11bn,business,article-jan-2042
January,Madagascar completes currency switch,business,article-jan-0050
January,McLeish ready for criticism,sport,article-jan-4860
January,Mobile games come of age,technology,article-jan-0180
January,More power to the people says HP,technology,article-jan-1582
January,Mourinho sends out warning shot,sport,article-jan-4456
January,Moya suffers shock loss,sport,article-jan-3002
January,Moyes U-turn on Beattie dismissal,sport,article-jan-2380
January,Murray returns to Scotland fold,sport,article-jan-3243
January,Mystery surrounds new Yukos owner,business,article-jan-3151
January,Off-colour Gardener storms to win,sport,article-jan-2619
January,Oil companies get Russian setback,business,article-jan-1811
January,Owen may have to return home,sport,article-jan-3831
January,Pearce keen on succeeding Keegan,sport,article-jan-4567
January,Poles play with GameBoy 'blip-pop',technology,article-jan-3938
January,Premier League probes Cole claims,sport,article-jan-4175
January,Prodigy Monfils blows away Gaudio,sport,article-jan-0237
January,Remote control rifle range debuts,technology,article-jan-0924
January,Robinson ready for difficult task,sport,article-jan-1731
January,Row brewing over peer-to-peer ads,technology,article-jan-3981
January,Rusedski angry over supplements,sport,article-jan-2769
January,S Korean lender faces liquidation,business,article-jan-2140
January,SFA awaits report over Mikoliunas,sport,article-jan-3329
January,Safin cool on Wimbledon,sport,article-jan-1087
January,Safin plays down Wimbledon hopes,sport,article-jan-0480
January,Satellite mapping aids Darfur relief,technology,article-jan-2591
January,Search sites get closer to users,technology,article-jan-2407
January,Security scares spark browser fix,technology,article-jan-1520
January,Senior Fannie Mae bosses resign,business,article-jan-3036
January,Solutions to net security fears,technology,article-jan-1051
January,Split-caps pay £194m compensation,business,article-jan-2864
January,Sports Stock Tips,sport,article-jan-4078
January,Strong quarterly growth for Nike,business,article-jan-0269
January,T-Mobile bets on 'pocket office',technology,article-jan-1728
January,Thanou desperate to make return,sport,article-jan-0976
January,Thompson says Gerrard should stay,sport,article-jan-3315
January,Time to get tough on friendlies?,sport,article-jan-3425
January,US peer-to-peer pirates convicted,technology,article-jan-1296
January,US top of supercomputing charts,technology,article-jan-4675
January,Venezuela and China sign oil deal,business,article-jan-3694
January,Weak end-of-year sales hit Next,business,article-jan-1550
January,Williams says he will never quit,sport,article-jan-1587
January,Winemaker rejects Foster's offer,business,article-jan-0587
January,Worldcom boss 'left books alone',business,article-jan-1650
January,Xbox 2 may be unveiled in summer,technology,article-jan-0867
January,Xbox power cable 'fire fear',technology,article-jan-0457
January,Yangtze Electric's profits double,business,article-jan-2075
January,Yukos loses US bankruptcy battle,business,article-jan-3244
February,7 business technology trends to watch,business,article-feb-3392
February,A November to remember,sport,article-feb-0704
February,A question of trust and technology,technology,article-feb-0913
February,Ad sales boost Time Warner profit,business,article-feb-3975
February,African double in Edinburgh,sport,article-feb-0641
February,Air passengers win new EU rights,business,article-feb-0608
February,Anti-spam screensaver scrapped,technology,article-feb-4436
February,Arsenal through on penalties,sport,article-feb-0930
February,BP surges ahead on high oil price,business,article-feb-4492
February,Bank holds interest rate at 4.75%,business,article-feb-4474
February,Bank set to leave rates on hold,business,article-feb-4340
February,Bekele sets sights on world mark,sport,article-feb-1116
February,Bitter Santini hits out at Spurs,sport,article-feb-2873
February,Blogs take on the mainstream,technology,article-feb-2303
February,Brewers' profits lose their fizz,business,article-feb-2977
February,Bush to outline 'toughest' budget,business,article-feb-4547
February,Buyers snap up Jet Airways' shares,business,article-feb-3154
February,Cairn shares up on new oil find,business,article-feb-1466
February,Campbell to extend sprint career,sport,article-feb-3116
February,Celtic make late bid for Bellamy,sport,article-feb-3641
February,Charlton 1-2 Liverpool,sport,article-feb-3724
February,Article no longer available in archive,N/A,N/A
February,Chepkemei joins Edinburgh line-up,sport,article-feb-1553
February,Article no longer available in archive,N/A,N/A
February,"Chinese billionaire targets Manchester United shares in new deal, reports suggest",business,article-feb-0192
February,Collins calls for Chambers return,sport,article-feb-2830
February,Commodore finds new lease of life,technology,article-feb-2366
February,Creator of first Apple Mac dies,technology,article-feb-3261
February,Cudicini misses Carling Cup final,sport,article-feb-2526
February,Davenport hits out at Wimbledon,sport,article-feb-3097
February,Davies favours Gloucester future,sport,article-feb-1454
February,Deutsche Telekom sees mobile gain,business,article-feb-0258
February,"Dibaba breaks 5,000m world record",sport,article-feb-4548
February,Dogged Federer claims Dubai crown,sport,article-feb-0679
February,Dollar hovers around record lows,business,article-feb-1000
February,Dundee Utd 4-1 Aberdeen,sport,article-feb-1821
February,EC calls truce in deficit battle,business,article-feb-4494
February,EU-US seeking deal on air dispute,business,article-feb-0250
February,Egypt and Israel seal trade deal,business,article-feb-2382
February,Egypt to sell off state-owned bank,business,article-feb-4407
February,El Guerrouj targets cross country,sport,article-feb-3768
February,FA ready to test out goal bleeper,sport,article-feb-3375
February,Article no longer available in archive,N/A,N/A
February,FBI agent colludes with analyst,business,article-feb-2553
February,Fast moving phone bugs appear,technology,article-feb-2750
February,Article no longer available in archive,N/A,N/A
February,Ferguson fears Milan cutting edge,sport,article-feb-0829
February,Finnan says Irish can win group,sport,article-feb-3941
February,Fit-again Betsen in France squad,sport,article-feb-1333
February,Five million Germans out of work,business,article-feb-3708
February,Format wars could 'confuse users',technology,article-feb-1684
February,Giggs handed Wales leading role,sport,article-feb-4876
February,Gritty return for Prince of Persia,technology,article-feb-1493
February,Hewitt survives Nalbandian epic,sport,article-feb-0113
February,Honda wins China copyright ruling,business,article-feb-2502
February,India seeks to boost construction,business,article-feb-2351
February,India's Deccan gets more planes,business,article-feb-1245
February,Indy buys into India paper,business,article-feb-2809
February,Intercom raises €101m in funding round making it the most valuable Irish tech firm,business,article-feb-4569
February,Iranian MPs threaten mobile deal,business,article-feb-4323
February,Irish company hit by Iraqi report,business,article-feb-3937
February,Italy aim to rattle England,sport,article-feb-1582
February,Italy to get economic action plan,business,article-feb-1312
February,Juninho demand for O'Neill talks,sport,article-feb-2836
February,Kenyon denies Robben Barca return,sport,article-feb-0505
February,Kerr frustrated at victory margin,sport,article-feb-3556
February,Klinsmann issues Lehmann warning,sport,article-feb-4691
February,LSE 'sets date for takeover deal',business,article-feb-4543
February,Lewis-Francis eyeing world gold,sport,article-feb-3028
February,Lifestyle 'governs mobile choice',technology,article-feb-1960
February,Looks and music to drive mobiles,technology,article-feb-4127
February,Man Utd through after Exeter test,sport,article-feb-4247
February,Martinez sees off Vinci challenge,sport,article-feb-2114
February,Microsoft makes anti-piracy move,technology,article-feb-0571
February,Middlesbrough 2-2 Charlton,sport,article-feb-0451
February,Mido makes third apology,sport,article-feb-1201
February,Millions buy MP3 players in US,technology,article-feb-4578
February,Mixed signals from French economy,business,article-feb-3474
February,Mobile picture power in your pocket,technology,article-feb-4987
February,Moore questions captaincy,sport,article-feb-4718
February,More Africans for tsunami game,sport,article-feb-2135
February,Murphy: That was a bruising battle,sport,article-feb-1118
February,Navratilova hits out at critics,sport,article-feb-4768
February,O'Driscoll out of Scotland game,sport,article-feb-4017
February,O'Gara revels in Ireland victory,sport,article-feb-1005
February,Owen dismisses fresh Real rumours,sport,article-feb-0504
February,PC ownership to 'double by 2010',technology,article-feb-1308
February,Paris promise raises Welsh hopes,sport,article-feb-2371
February,Parmalat sues 45 banks over crash,business,article-feb-3067
February,Progress on new internet domains,technology,article-feb-1134
February,Qantas considers offshore option,business,article-feb-1004
February,Radcliffe tackles marathon tasks,sport,article-feb-0814
February,Rangers seal Old Firm win,sport,article-feb-4229
February,Record fails to lift lacklustre meet,sport,article-feb-0630
February,Record year for Chilean copper,business,article-feb-2030
February,Republic to face China and Italy,sport,article-feb-1336
February,Robben sidelined with broken foot,sport,article-feb-3074
February,Robots learn 'robotiquette' rules,technology,article-feb-1812
February,Rolling out next generation's net,technology,article-feb-1149
February,Russia WTO talks 'make progress',business,article-feb-0800
February,Screensaver tackles spam websites,technology,article-feb-2206
February,Slim PlayStation triples sales,technology,article-feb-0110
February,Standard Life concern at LSE bid,business,article-feb-3700
February,"Steel firm 'to cut' 45,000 jobs",business,article-feb-4539
February,Stuart joins Norwich from Addicks,sport,article-feb-0707
February,Article no longer available in archive,N/A,N/A
February,Sun offers processing by the hour,technology,article-feb-2055
February,Tech helps disabled speed demons,technology,article-feb-4838
February,Telewest to challenge Sky Plus,technology,article-feb-2802
February,Thanou bullish over drugs hearing,sport,article-feb-2640
February,The Force is strong in Battlefront,technology,article-feb-4399
February,The gaming world in 2005,technology,article-feb-0406
February,Turkey knocks six zeros off lira,business,article-feb-2304
February,UK Coal plunges into deeper loss,business,article-feb-2170
February,US trade gap ballooned in October,business,article-feb-3783
February,Unilever shake up as profit slips,business,article-feb-4402
February,Wales get Williams fitness boost,sport,article-feb-1028
February,Wales stars need a rest - Ruddock,sport,article-feb-2316
February,Wall Street cool to eBay's profit,business,article-feb-0243
February,Warnings about junk mail deluge,technology,article-feb-2017
February,Web radio takes Spanish rap global,technology,article-feb-2660
February,Wenger shock at Newcastle dip,sport,article-feb-0224
February,When invention turns to innovation,technology,article-feb-2955
February,Who do you think you are?,technology,article-feb-4616
February,Wilkinson to miss Ireland match,sport,article-feb-0576
February,Winn-Dixie files for bankruptcy,business,article-feb-0519
February,Yukos sues four firms for $20bn,business,article-feb-1952
March,A year to remember for Irish,sport,article-mar-1126
March,An Irish Athletics Year,sport,article-mar-3331
March,Arnesen denies rift with Santini,sport,article-mar-3141
March,Asia shares defy post-quake gloom,business,article-mar-3697
March,Bank payout to Pinochet victims,business,article-mar-3655
March,Barcelona title hopes hit by loss,sport,article-mar-2120
March,Bargain calls widen Softbank loss,business,article-mar-2380
March,Bayern Munich 3-1 Arsenal,sport,article-mar-1445
March,Benitez deflects blame from Dudek,sport,article-mar-1627
March,Blog reading explodes in America,technology,article-mar-0220
March,Broadband challenges TV viewing,technology,article-mar-1595
March,Broadband in the UK growing fast,technology,article-mar-4085
March,Calder fears for Scottish rugby,sport,article-mar-2495
March,Captains lining up for Aid match,sport,article-mar-4902
March,Celts savour Grand Slam prospect,sport,article-mar-3484
March,Chelsea ridiculed over complaint,sport,article-mar-1905
March,China keeps tight rein on credit,business,article-mar-1702
March,China net cafe culture crackdown,technology,article-mar-4607
March,China suspends 26 power projects,business,article-mar-4510
March,Christmas shoppers flock to tills,business,article-mar-1543
March,Collins named UK Athletics chief,sport,article-mar-0210
March,Court mulls file-sharing future,technology,article-mar-1989
March,Crude oil prices back above $50,business,article-mar-4293
March,Cyber criminals step up the pace,technology,article-mar-0521
March,DVD copy protection strengthened,technology,article-mar-3692
March,Deutsche attacks Yukos case,business,article-mar-2874
March,Disappointed Scott in solid start,sport,article-mar-3420
March,Durex maker SSL awaits firm bid,business,article-mar-3360
March,EA to take on film and TV giants,technology,article-mar-0037
March,Edu blasts Arsenal,sport,article-mar-2432
March,Article no longer available in archive,N/A,N/A
March,Europe backs digital TV lifestyle,technology,article-mar-1244
March,Farrell saga to drag on - Lindsay,sport,article-mar-1251
March,Featured: 'Golden economic period' to end,business,article-mar-0183
March,Feta cheese battle reaches court,business,article-mar-2000
March,Firms pump billions into pensions,business,article-mar-3083
March,First look at PlayStation 3 chip,technology,article-mar-3722
March,Ford gains from finance not cars,business,article-mar-1165
March,Fuming Robinson blasts officials,sport,article-mar-2123
March,GB quartet get cross country call,sport,article-mar-3909
March,Gadget market 'to grow in 2005',technology,article-mar-0579
March,Gadgets galore on show at fair,technology,article-mar-3023
March,Games help you 'learn and play',technology,article-mar-0977
March,Gaming firm to sell UK dog tracks,business,article-mar-4216
March,Germany nears 1990 jobless level,business,article-mar-2195
March,Greek pair attend drugs hearing,sport,article-mar-4576
March,Gronkjaer agrees switch to Madrid,sport,article-mar-2382
March,Article no longer available in archive,N/A,N/A
March,Half of UK's mobiles 'go online',technology,article-mar-0012
March,Hantuchova in Dubai last eight,sport,article-mar-4343
March,Have hackers recruited your PC?,technology,article-mar-3567
March,Healey targets England comeback,sport,article-mar-1674
March,High fuel costs hit US airlines,business,article-mar-3810
March,High fuel prices hit BA's profits,business,article-mar-3301
March,Hotspot users gain free net calls,technology,article-mar-2795
March,House prices drop as sales slow,business,article-mar-3037
March,House prices show slight increase,business,article-mar-1629
March,ITunes user sues Apple over iPod,technology,article-mar-0481
March,India widens access to telecoms,business,article-mar-0388
March,Iran jails blogger for 14 years,technology,article-mar-1453
March,Irish duo could block Man Utd bid,business,article-mar-1606
March,Italy 8-38 Wales,sport,article-mar-1230
March,Johnson uncertain about Euro bid,sport,article-mar-3153
March,Kirwan demands Italy consistency,sport,article-mar-0170
March,Liberian economy starts to grow,business,article-mar-4481
March,Malaysia lifts Islamic bank limit,business,article-mar-4754
March,Man Utd stroll to Cup win,sport,article-mar-3612
March,Man auctions ad space on forehead,technology,article-mar-3927
March,Manufacturing recovery 'slowing',business,article-mar-4340
March,Markets signal Brazilian recovery,business,article-mar-1335
March,Merritt close to indoor 400m mark,sport,article-mar-2040
March,Microsoft debuts security tools,technology,article-mar-0033
March,Microsoft releases patches,technology,article-mar-2536
March,Minister hits out at Yukos sale,business,article-mar-4512
March,Mirza shocks Kuznetsova,sport,article-mar-4615
March,Article no longer available in archive,N/A,N/A
March,Mourinho receives Robson warning,sport,article-mar-4246
March,Moya emotional after Davis Cup win,sport,article-mar-4861
March,Nasdaq planning $100m share sale,business,article-mar-4279
March,Newcastle 2-1 Bolton,sport,article-mar-4599
March,Newcastle to join Morientes race,sport,article-mar-2276
March,News Corp makes $5.4bn Fox offer,business,article-mar-1739
March,Nigeria to boost cocoa production,business,article-mar-4407
March,Nintendo DS aims to touch gamers,technology,article-mar-3144
March,Novartis hits acquisition trail,business,article-mar-0182
March,Profits stall at China's Lenovo,business,article-mar-2488
March,Putin backs state grab for Yukos,business,article-mar-4584
March,Quiksilver moves for Rossignol,business,article-mar-4102
March,Redknapp poised for Saints,sport,article-mar-3792
March,Robertson out to retain Euro lure,sport,article-mar-0131
March,Seamen sail into biometric future,technology,article-mar-4398
March,Singapore growth at 8.1% in 2004,business,article-mar-0463
March,Article no longer available in archive,N/A,N/A
March,Slovakia reach Hopman Cup final,sport,article-mar-0029
March,Sociedad set to rescue Mladenovic,sport,article-mar-4749
March,Sony wares win innovation award,technology,article-mar-3392
March,Soros group warns of Kazakh close,business,article-mar-0952
March,Sport-loving inventors whose tech could change the game,technology,article-mar-1203
March,Sprinter Walker quits athletics,sport,article-mar-2048
March,Article no longer available in archive,N/A,N/A
March,Stock market eyes Japan recovery,business,article-mar-3318
March,Swiss cement firm in buying spree,business,article-mar-2788
March,Text message record smashed,technology,article-mar-4562
March,The pirates with no profit motive,technology,article-mar-0620
March,Tsunami to cost Sri Lanka $1.3bn,business,article-mar-4001
March,UK Athletics agrees new kit deal,sport,article-mar-1599
March,US cyber security chief resigns,technology,article-mar-2785
March,US hacker breaks into T-Mobile,technology,article-mar-1454
March,US industrial output growth eases,business,article-mar-1913
March,"US insurer Marsh cuts 2,500 jobs",business,article-mar-4140
March,US manufacturing expands,business,article-mar-4357
March,US to rule on Yukos refuge call,business,article-mar-4898
March,Van Nistelrooy set to return,sport,article-mar-0550
March,Vickery upbeat about arm injury,sport,article-mar-2508
March,Video phones act as dating tools,technology,article-mar-2039
March,Virgin Blue shares plummet 20%,business,article-mar-4111
March,Article no longer available in archive,N/A,N/A
March,Wada will appeal against ruling,sport,article-mar-4582
March,Wales critical of clumsy Grewcock,sport,article-mar-3651
March,Wales silent on Grand Slam talk,sport,article-mar-3663
March,Wenger rules out new keeper,sport,article-mar-4500
March,Wenger signs new deal,sport,article-mar-1916
April,Axa Sun Life cuts bonus payments,business,article-apr-1897
April,BT boosts its broadband packages,technology,article-apr-2967
April,Bates seals takeover,sport,article-apr-2939
April,Beckham virus spotted on the net,technology,article-apr-0145
April,Broadband fuels online expression,technology,article-apr-1938
April,Broadband in the UK gathers pace,technology,article-apr-1748
April,Burren awarded Egyptian contracts,business,article-apr-2559
April,Business fears over sluggish EU economy,business,article-apr-1306
April,Candela completes Bolton switch,sport,article-apr-2454
April,Cannabis hopes for drug firm,business,article-apr-0039
April,Castaignede fires Laporte warning,sport,article-apr-1044
April,Casual gaming to 'take off',technology,article-apr-2151
April,Chelsea sack Mutu,sport,article-apr-2808
April,China Aviation seeks rescue deal,business,article-apr-4324
April,Classy Henman makes winning start,sport,article-apr-2873
April,Collins banned in landmark case,sport,article-apr-4741
April,Concerns over Windows ATMs,technology,article-apr-0433
April,Connors boost for British tennis,sport,article-apr-4890
April,Crossrail link 'to get go-ahead',business,article-apr-4575
April,Article no longer available in archive,N/A,N/A
April,Cyber crime booms in 2004,technology,article-apr-0228
